{
  "candidate_id": "EXAMPLE_UNVERIFIED",
  "repo_id": "example/unverified-lora",
  "base_model_family": "SDXL",
  "base_model_id": "some-other-model",
  "revision": null,
  "license": null,
  "weight_filename": "weights.safetensors",
  "size_mb": null,
  "source_verified": false,
  "visual_previews_verified": false,
  "redistribution_allowed": null,
  "commercial_output_allowed": null,
  "license_verified": false,
  "license_evidence_url": null,
  "output_use_allowed": null
}
